{
  "name": "Example Title",
  "delegate_descriptor_id": "500123",
  "order": 10,
  "rule_order": 42.5,
  "settings": "example_value",
  "timeout": 10,
  "delay_next": true,
  "negate": true,
  "enabled": true,
  "published": true,
  "dirty": true,
  "created_at": "2026-01-15T10:30:00Z",
  "updated_at": "2026-01-15T10:30:00Z"
}